<?xml version="1.0"?>
<!--
/**
 * Maho
 *
 * @package    Mage_GiftMessage
 * @copyright  Copyright (c) 2006-2020 Magento, Inc. (https://magento.com)
 * @copyright  Copyright (c) 2022 The OpenMage Contributors (https://openmage.org)
 * @copyright  Copyright (c) 2025-2026 Maho (https://mahocommerce.com)
 * @license    https://opensource.org/licenses/afl-3.0.php Academic Free License (AFL 3.0)
 */
-->
<config xmlns:xsi="http://www.w3.org/2001/XMLSchema-instance"
        xsi:noNamespaceSchemaLocation="../../../../../../lib/Maho/Schema/system.xsd">
    <sections>
        <sales>
            <groups>
                <gift_options translate="label" module="giftmessage">
                    <label>Gift Options</label>
                    <sort_order>100</sort_order>
                    <show_in_default>1</show_in_default>
                    <show_in_website>1</show_in_website>
                    <show_in_store>0</show_in_store>
                    <fields>
                        <allow_order translate="label">
                            <label>Allow Gift Messages on Order Level</label>
                            <frontend_type>boolean</frontend_type>
                            <sort_order>1</sort_order>
                            <show_in_default>1</show_in_default>
                            <show_in_website>1</show_in_website>
                            <show_in_store>0</show_in_store>
                        </allow_order>
                        <allow_items translate="label">
                            <label>Allow Gift Messages for Order Items</label>
                            <frontend_type>boolean</frontend_type>
                            <sort_order>5</sort_order>
                            <show_in_default>1</show_in_default>
                            <show_in_website>1</show_in_website>
                            <show_in_store>0</show_in_store>
                        </allow_items>
                    </fields>
                </gift_options>
            </groups>
        </sales>
    </sections>
</config>
